topic,notes
State North Carolina,"['Julian F. Keith Alcohol and Drug Abuse Treatment Center. JFK ADATC operates under the authority of the State of North Carolina through the Division of State Operated Healthcare Facilities -- Note added 9/22/15 17:00', 'The Board of Podiatry Examiners for the State of North Carolina  -- Note added 9/14/15 20:32', 'State of North Carolina -- Note added 1/14/14 13:05', 'State of North Carolina Office of Information Technology Services -- Note added 9/15/15 16:49', 'State of North Carolina Japan Office -- Note added 7/24/13 16:40']"
Board Examiners,"['LA Board of Examiners of Nursing Facility Administrators -- Note added 9/22/15 20:03', 'Louisiana Board of Examiners of Certified Shorthand Reporters -- Note added 9/23/15 12:16', 'Louisiana Board of Examiners in Dietetics and Nutrition  -- Note added 8/24/15 14:48', 'Licensed Professional Counselors Board of Examiners -- Note added 8/24/15 14:53', 'LLPVRC Board of Examiners -- Note added 8/24/15 14:54', 'Louisiana State Board of Examiners of Psychologists   -- Note added 8/24/15 14:55', 'Louisiana State Board of Examiners for Sanitarians -- Note added 9/23/15 16:47', 'Louisiana State Board of Examiners of Interior Designers -- Note added 9/23/15 16:48', 'NC Board of Examiners of electrical contractors -- Note added 9/11/15 20:39', 'NC Board of Examiners for engineers and surveyors -- Note added 9/11/15 20:40', 'NC Board of Examiners for Speech Language and Pathologist & Audiologist n  -- Note added 9/14/15 20:30', 'North Carolina State Board of Examiners of Plumbing, Heating and Fire Sprinkler Contractors -- Note added 9/15/15 16:46', 'he North Carolina State Board of Examiners in Optometry -- Note added 9/15/15 16:58']"
Louisiana State Board,"['Louisiana State Board of Social Work Examiners -- Note added 8/24/15 14:41', ' Louisiana State Board of Chiropractic Examiners -- Note added 8/24/15 14:42', 'Louisiana State Board of Architectural Examiners -- Note added 1/14/14 14:13', 'Louisiana State Board of Examiners of Psychologists   -- Note added 8/24/15 14:55', 'Louisiana State Board of Examiners for Sanitarians -- Note added 9/23/15 16:47', 'Louisiana State Board of Examiners of Interior Designers -- Note added 9/23/15 16:48', 'Louisiana State Board of Private Investigator Examiners -- Note added 8/24/15 14:55']"
Virgin Islands,"['Legislature of the Virgin Islands -- Note added 8/18/14 14:07', 'National Archives and Records Management Unit, Government of the Virgin Islands -- Note added 8/18/14 14:03', 'U.S. Virgin Islands Bureau of Economic Research -- Note added 8/18/14 14:14', 'U.S. Virgin Islands Economic Development Authority -- Note added 8/18/14 14:12', 'Virgin Islands Department of Education -- Note added 8/18/14 14:08', 'Office of the Virgin Islands Inspector General -- Note added 8/18/14 14:13', 'U.S. Virgin Islands Police Department -- Note added 8/18/14 14:16', 'Travel and tourism site for the US Virgin Islands -- Note added 6/6/13 19:47', 'Supreme Court of the United States Virgin Islands -- Note added 8/18/14 14:06', 'Virgin Islands Lottery -- Note added 6/12/13 14:29']"
State Board Examiners,"['Louisiana State Board of Examiners of Psychologists   -- Note added 8/24/15 14:55', 'Louisiana State Board of Examiners for Sanitarians -- Note added 9/23/15 16:47', 'Louisiana State Board of Examiners of Interior Designers -- Note added 9/23/15 16:48', 'North Carolina State Board of Examiners of Plumbing, Heating and Fire Sprinkler Contractors -- Note added 9/15/15 16:46', 'he North Carolina State Board of Examiners in Optometry -- Note added 9/15/15 16:58']"
Department Health Human,"['NC Assistive technology Program - Receives grant funding under Public Law 108-364  through the Rehabilitation Services Administration, U.S. Department of Education, and is administered by the N.C. Department of Health and Human Services, Division of Vocational Rehabilitation Services -- Note added 11/12/15 15:02', 'Radiation Protection Section, NC Department of Health and Human Services -- Note added 1/14/14 14:18', 'Tobacco Free Schools, NC Department of Health and Human Services -- Note added 2/25/14 13:20', 'North Carolina Well Contractors Certification Commission - protects the public health and safety by ensuring the integrity and competence of well contractors through examination, certification, continuing education and enforcement. The Well Contractors Certification Unit is now part of the Department of Health and Human Services. -- Note added 11/12/15 12:57', 'Aging and Disability Services Division, Department of Health and Human Services, State of Nevada -- Note added 6/17/13 15:40', 'West Virginia Department of Health and Human Resources -- Note added 7/24/14 5:50']"
NC Board,"['NC Board of Athletic Trainers Examiners -- Note added 9/11/15 20:38', 'NC Board of Examiners of electrical contractors -- Note added 9/11/15 20:39', 'NC Board of Examiners for engineers and surveyors -- Note added 9/11/15 20:40', 'NC Board of Nursing Homes Administrators -- Note added 9/11/15 20:41', 'NC Board of Funeral Services -- Note added 9/11/15 20:41', 'NC Board of Law Examiners -- Note added 9/14/15 20:44', 'NC Board of Examiners for Speech Language and Pathologist & Audiologist n  -- Note added 9/14/15 20:30', 'Welcome to the NC Board of Landscape Architects -- Note added 9/14/15 20:31', 'NC Board of Nursing -- Note added 9/14/15 20:31', 'NC Board of Pharmacy -- Note added 9/14/15 20:32']"
North Carolina Office,"['North Carolina Office of the Commissioner of Banks (NCCOB) -- Note added 11/19/13 18:51', 'The North Carolina Office of EMS -- Note added 9/15/15 16:07', 'State of North Carolina Office of Information Technology Services -- Note added 9/15/15 16:49', 'North Carolina Office of Administrative Hearings -- Note added 9/15/15 16:57', 'Historical Publications, North Carolina Office of Archives and History, Department of Cultural Resources - www.ncpublications.com -- Note added 6/6/13 18:34', 'The Way We Lived in North Carolina, presented by http://www.ah.dcr.state.nc.us/ The North Carolina Office of Archives & History. -- Note added 8/13/14 17:41']"
North Carolina State,"['North Carolina State Board of Dental Examiners -- Note added 9/14/15 20:40', 'North Carolina State Board of Examiners of Plumbing, Heating and Fire Sprinkler Contractors -- Note added 9/15/15 16:46', 'he North Carolina State Board of Examiners in Optometry -- Note added 9/15/15 16:58', 'The North Carolina State Improvement Project (NC SIP ). NC SIP is a program in the Exceptional Children Division of the North Carolina Department of Public Instruction (NC DPI). -- Note added 9/15/15 17:19', 'North Carolina State Health Plan for Teachers and State Employees -- Note added 7/25/14 15:10']"
"state agencies, at:","['*state.ak.us pattern to include Alaska state agencies, such as those at: https://www.google.com/#q=site:state.ak.us  -- Note added 7/8/14 12:25', '*state.al.us pattern to include Alabama state agencies, such as those at: https://www.google.com/#q=site:state.al.us  -- Note added 7/8/14 12:26', '*state.ca.us pattern to include California state agencies, such as those at: https://www.google.com/#q=site:state.ca.us  -- Note added 6/27/14 16:14', '*state.fl.us pattern to include Florida state agencies, such as those at: https://www.google.com/#q=site:state.fl.us   -- Note added 6/27/14 16:15', 'http://www.state.nj.us/ and http://www.nj.gov both resolve to the same site. n*state.nj.us pattern to include New Jersey state agencies, such as those at: https://www.google.com/#q=site:state.nj.us  -- Note added 7/8/14 13:04']"
Travel Tourism Sites,"['Travel and Tourism Sites for Nevada -- Note added 6/6/13 19:11', 'Travel and Tourism Sites for Oklahoma -- Note added 6/6/13 19:11', 'Travel and Tourism Sites for South Dakota -- Note added 6/6/13 19:11', 'Travel and Tourism Sites for Texas -- Note added 6/6/13 19:11', 'Travel and Tourism Sites for Wisconsin -- Note added 6/6/13 19:11', 'Travel and Tourism Sites for Virginia -- Note added 6/6/13 19:11', 'Travel and Tourism Sites for Delaware -- Note added 6/6/13 19:11', 'Travel and Tourism Sites for Guam -- Note added 6/6/13 19:11', 'Travel and Tourism Sites for Maine -- Note added 6/6/13 19:11', 'Travel and Tourism Sites for Mississippi -- Note added 6/6/13 19:11']"
